resource_id,resource_name,acronym,resource_type,description,homepage_url,thematic_domains,data_product_types,data_formats,geographic_coverage,spatial_resolution,temporal_coverage,temporal_resolution,data_sources,free_download,access_conditions,api_available,license,institutional_status,owner_or_manager,last_verified,notes
DR0039,Global Biodiversity Information Facility Integrated Publishing Toolkit,GBIF IPT,data_service,Software e serviço de publicação de datasets de biodiversidade em padrões interoperáveis.,https://www.gbif.org/ipt,biodiversidade | metadados,datasets publicados | metadados | arquivos Darwin Core,Darwin Core Archive | EML,global,varia conforme o dataset,varia conforme o dataset,varia conforme o dataset,instituições publicadoras,não se aplica,depende da instalação e do dataset,sim,software Apache 2.0; dados variam,consórcio,GBIF e instituições hospedeiras,2026-07-18,"Incluído como infraestrutura de gestão/publicação, não como base agregadora de ocorrências."
DR0040,TRY Plant Trait Database,TRY,database,Base global de características funcionais de plantas reunidas de múltiplas fontes.,https://www.try-db.org/,vegetação | plantas | ecologia funcional | biodiversidade,traits | espécies | metadados de datasets,formatos tabulares,global,"indivíduo, população ou estudo; varia",varia conforme o dataset,por observação,campo | laboratório | literatura | colaboradores,parcial,cadastro | solicitação | condições por dataset,não,termos TRY e dos contribuidores,consórcio acadêmico,TRY Consortium / Max Planck Institute for Biogeochemistry,2026-07-18,Acesso não é totalmente aberto; uso e redistribuição dependem das condições dos contribuidores.
DR0041,Botanical Information and Ecology Network,BIEN,database,"Base integrada de ocorrências, inventários de vegetação, taxonomia e atributos de plantas.",https://bien.nceas.ucsb.edu/bien/,vegetação | plantas | biodiversidade | ecologia,ocorrências | parcelas | traits | taxonomia,CSV | acesso por pacote R e banco,Américas e cobertura global parcial,"ponto, parcela e espécie; varia",histórica ao presente; varia,por registro,herbários | parcelas | literatura | bases parceiras,sim,aberto,sim,varia conforme a fonte,consórcio acadêmico,BIEN Working Group / NCEAS,2026-07-18,Atribuição e restrições podem depender da fonte originalmente integrada.
DR0042,AmeriFlux,AmeriFlux,monitoring_system,"Rede de torres de fluxos de carbono, água e energia nas Américas.",https://ameriflux.lbl.gov/data/,carbono | clima | ecossistemas | fluxos,fluxos turbulentos | meteorologia | dados processados,CSV | ZIP | formatos padronizados,continental — Américas,ponto de torre e área de influência,1996 ao presente; varia por sítio,30 minutos | diária | anual; varia,torres eddy covariance | sensores meteorológicos,sim,cadastro | termos de uso por dataset,sim,CC BY 4.0 ou política indicada,consórcio acadêmico,AmeriFlux Management Project / Lawrence Berkeley National Laboratory,2026-07-18,"Comparações exigem considerar processamento, cobertura temporal e área de influência de cada torre."
DR0043,FLUXNET,FLUXNET,database,Rede global harmonizada de medições de fluxos entre ecossistemas e atmosfera.,https://fluxnet.org/data/,carbono | clima | ecossistemas | água,fluxos | meteorologia | produtos harmonizados,CSV | ZIP,global,ponto de torre e área de influência,varia por coleção e sítio,30 minutos | diária | mensal | anual,eddy covariance | sensores meteorológicos | processamento harmonizado,parcial,cadastro | licenças por coleção,não,licença por coleção ou sítio,consórcio acadêmico,FLUXNET community,2026-07-18,FLUXNET integra redes como AmeriFlux; evitar dupla contagem de sítios.
DR0044,Global Forest Watch,GFW,platform,Plataforma de monitoramento e análise de florestas com dados de múltiplas fontes.,https://www.globalforestwatch.org/,florestas | vegetação | desmatamento | fogo | carbono,mapas | alertas | estatísticas | camadas,GeoTIFF | Shapefile | CSV | tiles | API; varia,global,varia conforme a camada,varia conforme a camada,quase em tempo real a anual,satélites | governos | pesquisa | modelos,sim,aberto | cadastro para alguns serviços,sim,varia conforme o provedor da camada,organização sem fins lucrativos,World Resources Institute e parceiros,2026-07-18,É plataforma agregadora; citar o provedor e produto original da camada utilizada.
DR0045,Global Carbon Atlas,Global Carbon Atlas,platform,Plataforma de visualização e exploração de fluxos e emissões globais de carbono.,https://globalcarbonatlas.org/,carbono | emissões | mudanças climáticas,mapas | séries | gráficos | indicadores,CSV | visualização web; varia,global e nacional,"nacional, regional e grades; varia",histórica ao presente; varia,anual; alguns produtos mensais,inventários | modelos | observações | Global Carbon Project,sim,aberto,desconhecido,termos e fontes indicados por produto,consórcio acadêmico,Global Carbon Project,2026-07-18,"Verificar fonte, versão e metodologia do produto específico visualizado."
DR0046,EDGAR — Emissions Database for Global Atmospheric Research,EDGAR,database,Inventário global espacializado de emissões antropogênicas de gases de efeito estufa e poluentes.,https://edgar.jrc.ec.europa.eu/,emissões | carbono | atmosfera | mudanças climáticas,grades de emissões | tabelas nacionais | séries temporais,NetCDF | XLSX | CSV | mapas,global,"tipicamente 0,1 grau; varia conforme a versão",1970 ao presente; varia conforme a versão,anual | mensal em produtos selecionados,estatísticas de atividade | fatores de emissão | modelos,sim,aberto,desconhecido,licença da Comissão Europeia; consultar versão,público internacional,European Commission Joint Research Centre,2026-07-18,Versão e setor de emissão devem ser registrados para reprodutibilidade.
DR0047,Copernicus Data Space Ecosystem,CDSE,data_service,"Serviço de descoberta, acesso e processamento de dados Sentinel e outras missões Copernicus.",https://dataspace.copernicus.eu/,sensoriamento remoto | vegetação | clima | água | solo,imagens de satélite | mosaicos | produtos processados,SAFE | GeoTIFF | JPEG2000 | NetCDF | formatos variados,global,10 m a quilômetros; depende do sensor e produto,2014 ao presente; varia por missão,dias a semanas; varia por missão,satélites Sentinel | missões contribuintes,sim,cadastro,sim,Copernicus Data and Information Policy,público internacional,European Commission / ESA e operadores,2026-07-18,"Registrar missão, nível de processamento, órbita, resolução e data da cena."
DR0048,Earth System Grid Federation,ESGF,data_service,"Infraestrutura federada para distribuição de modelos climáticos, incluindo CMIP.",https://esgf.llnl.gov/,clima | mudanças climáticas | modelos do sistema terrestre,simulações | projeções | reanálises selecionadas,NetCDF,global,varia conforme o modelo,histórico e cenários futuros,subdiária a anual; varia,modelos climáticos e do sistema terrestre,sim,aberto | cadastro em alguns nós,sim,varia conforme o projeto e dataset,consórcio internacional,ESGF partners / DOE,2026-07-18,"CMIP6 é uma coleção distribuída na ESGF; registrar modelo, experimento, membro e grade."
DR0049,International Long Term Ecological Research Network,ILTER,information_system,Rede internacional de sítios e projetos de pesquisa ecológica de longa duração.,https://www.ilter.network/,ecologia | biodiversidade | clima | ecossistemas,metadados | séries ecológicas | informações de sítios,formatos variados,global,"sítio, parcela e região; varia",longa duração; varia por sítio,varia por variável e sítio,campo | sensores | laboratório | monitoramento,parcial,"aberto, solicitação ou restrito conforme o sítio",desconhecido,varia conforme o dataset,consórcio acadêmico,ILTER e redes nacionais,2026-07-18,A rede facilita descoberta e integração; disponibilidade efetiva depende do sítio ou repositório.
DR0050,ORNL Distributed Active Archive Center,ORNL DAAC,repository,"Centro NASA para dados de processos biogeoquímicos, ecologia terrestre e dinâmica ambiental.",https://daac.ornl.gov/,ecologia | carbono | vegetação | solo | sensoriamento remoto,datasets | mapas | séries | produtos de missões,GeoTIFF | NetCDF | CSV | HDF | formatos variados,global,varia conforme o dataset,varia conforme o dataset,varia conforme o dataset,satélites | campo | modelos | campanhas NASA,sim,cadastro Earthdata para alguns downloads,sim,política de dados NASA; licença por dataset,público,NASA / Oak Ridge National Laboratory,2026-07-18,Inclui datasets individuais como FRED; citar DOI e versão do dataset utilizado.
